DP330,D6,"Filtering topics via regular expression during playback: ""Pull request 1034 adds a new option --topics-regex that allows filtering topics via regular expressions...",-,Documentation,No,,,,,,,,,,
DP331,D6,"Allow plugins to register their own CLI verb arguments: ""Pull request 1209 adds the ability for rosbag2 plugins to register an optional Python entrypoint providing plugin-specific CLI argument values.""",-,Documentation,No,,,,,,,,,,
DP332,D6,"Modification of content of slots attribute: ""In Iron, this attribute no longer contains only the field names from the message structure, but the field names for all the class members.""",-,Documentation,No,,,,,,,,,,
DP333,D6,"Map display can now be shown as binary: ""The RViz map display can now display the map as binary, with a settable threshold.""",-,Documentation,No,,,,,,,,,,
DP334,D6,"Camera display plugin respects the ROI in the CameraInfo message: ""The CameraDisplay plugin now honors the region-of-interest (ROI) settings in the CameraInfo message.""",-,Documentation,Yes,,,,visualização de imagem/objetos,,,,,,
DP335,D6,"Binary STL files from SOLIDWORKS work without error: ""A change was made to the STL loader such that it accepts binary STL files from SOLIDWORKS that have the word 'solid' in them.""",-,Documentation,No,,,,,,,,,,
DP336,D6,"Tracing instrumentation is now included by default on Linux: ""In Iron, the tracing instrumentation and tracepoints are included by default; the LTTng tracer is therefore now a ROS 2 dependency.""",-,Documentation,No,,,,,,,,,,
DP337,D6,"New tracepoints for rclcpp intra-process are added: ""New tracepoints have been added to support rclcpp intra-process communication.""",-,Documentation,Yes,,,,"comunicação intra-processo, monitoramento",,,,,,
DP338,D7,"Changes to how ROS 2 and Gazebo integrate: gz_*_vendor packages: ""To make it easier for ROS 2 packages to consume Gazebo packages, there are now gz_*_vendor packages.""",-,Documentation,No,,,,,,,,,,
DP339,D7,"New VelocityStamped message: ""New VelocityStamped message: Added a new message with all fields needed to define a velocity and transform it.""",-,Documentation,No,,,,,,,,,,
DP340,D7,"Adds ARROW_STRIP to Marker.msg: ""Added new type of Marker, ARROW_STRIP, to Marker.msg.""",-,Documentation,No,,,,,,,,,,
DP341,D7,Support lazy subscribers: See https://github.com/ros-perception/image_common/issues/272 for more details.,-,Documentation,No,,,,,,,,,,
DP342,D7,"Expose option to set callback groups: ""Expose option to set callback groups: See https://github.com/ros-perception/image_common/issues/274 for more details.""",-,Documentation,No,,,,,,,,,,
DP343,D7,"Enable allow list: ""Added parameter so users can selectively disable image_transport plugins at runtime.""",-,Documentation,No,,,,,,,,,,
DP344,D7,"Advertise and subscribe with custom QoS: ""Allow users to pass in a custom quality-of-service when creating image_transport publishers and subscribers.""",-,Documentation,No,,,,,,,,,,
DP345,D7,"Added rclcpp component to Republish: ""Users can now start the image_transport republisher node as an rclcpp_component.""",-,Documentation,No,,,,,,,,,,
DP346,D7,"TypeAdapters support: ""TypeAdapters support: Allows users to use Type Adaptation within message_filters.""",-,Documentation,No,,,,,,,,,,
DP347,D7,"Add get type description service: ""Implements the ~/get_type_description service which allows external users to get descriptions of each type that a node offers.""",-,Documentation,No,,,,,,,,,,
DP348,D7,"Type support helper for services: ""New type support helper for services rclcpp::get_service_typesupport_handle is added to extract service type support handle.""",-,Documentation,No,,,,,,,,,,
DP349,D7,"ParameterEventHandler: ""New class ParameterEventHandler allows us to monitor and respond changes to parameters via parameter events.""",-,Documentation,No,,,,,,,,,,
DP350,D7,"Added a --log-file-name command line argument: ""It is now possible to use --log-file-name command line argument to specify the log file name prefix.""",-,Documentation,No,,,,,,,,,,
DP351,D7,"Added QoS to subscription options: ""A user-settable QoS parameter was added to the TopicStatisticsOptions, which allows the statistics to have a different QoS from the subscription itself.""",-,Documentation,No,,,,,,,,,,
DP352,D7,"Add clients and services count: ""It is now possible to get the number of clients created by a service.""",-,Documentation,No,,,,,,,,,,
DP353,D7,"type sub-command supported: ""It is now possible to use the type sub-command to check the action type.""",-,Documentation,No,,,,,,,,,,
DP354,D7,"Service recording and playback: ""It is now possible to record and play service data with the ros2bag command line interface.""",-,Documentation,No,,,,,,,,,,
DP355,D7,"New filter modes: ""It is now possible to filter by topic type.""",-,Documentation,No,,,,,,,,,,
DP356,D7,"Player and Recorder are now exposed as rclcpp components: ""This allows a 'zero-copy' when using intra-process communication during data record or reply.""",-,Documentation,No,,,,,,,,,,
DP357,D7,"Added option to disable recorder keyboard controls: ""Added option to disable recorder keyboard controls.""",-,Documentation,No,,,,,,,,,,
DP358,D7,"Use middleware send and receive timestamps from message_info during recording: ""rosbag2 now uses the send and receive timestamps as provided by the middleware.""",-,Documentation,No,,,,,,,,,,
DP359,D7,"Added compression threads priority to record options: ""It is now possible to specify the priority of the thread that performs compression.""",-,Documentation,Yes,,,,prioridade dos threads de compressão de dados,,,,,,
DP360,D7,"Added ability to split already existing ros2 bags by time: ""Added start_time_ns and end_time_ns to the StorageOptions to exclude messages not in [start_time;end_time] during the ros2 bag convert operation.""",-,Documentation,No,,,,,,,,,,
DP361,D7,"Store serialized metadata in bag files directly: ""rosbag2 has always stored metadata in the metadata.yaml file associated with a bag file. Now the metadata is also stored in each bag file.""",-,Documentation,No,,,,,,,,,,
DP362,D7,"Store ROS_DISTRO name in the metadata: ""Store ROS_DISTRO name in the metadata.""",-,Documentation,No,,,,,,,,,,
DP363,D7,"Added introspection QoS methods to Python bindings: ""It is now possible to instrospect QoS setting from Python bindings.""",-,Documentation,No,,,,,,,,,,
DP364,D7,"Added interfaces to support key annotation: ""The key annotation allows indicating that a data member is part of the key, which can have zero or more key fields and can be applied to structure fields of various types.""",-,Documentation,No,,,,,,,,,,
DP365,D7,"Added regex filter field for TF display: ""When there are many frames on /tf it can be hard to properly visualize them in RViz. Now it is possible to filter frames using regular expressions.""",-,Documentation,No,,,,,,,,,,
DP366,D7,"Append measured subscription frequency to topic status: ""It is possible to visualize Hz in the topic status widget.""",-,Documentation,No,,,,,,,,,,
DP367,D7,"Reset functionality: ""It is possible to reset Time using a new service or using the keyboard shortcut R.""",-,Documentation,No,,,,,,,,,,
DP368,D7,"Added support for point_cloud_transport: ""It is possible to subscribe to point clouds using the point_cloud_transport package.""",-,Documentation,No,,,,,,,,,,
DP369,D7,"Feature parity with RViz for ROS: ""It is possible to use the same plugins available in the ROS 1 version.""",-,Documentation,No,,,,,,,,,,
DP370,D7,"Camera info display: ""It is possible to visualize CameraInfo messages in the 3D scene.""",-,Documentation,Yes,,,,exibição de informações da câmera,,,,,,
DP371,D7,"Added tl_expected: ""std::expected is C++23 feature, which is not yet supported in ROS 2. However, it is possible to use tl::expected from rcpputils via a backported implementation.",-,Documentation,No,,,,,,,,,,
DP372,D7,"Add human readable date to logging formats: ""It is now possible to output dates in a human readable format when using console logging by using the {date_time_with_ms} token in the RCUTILS_CONSOLE_OUTPUT_FORMAT environment variable.""",-,Documentation,No,,,,,,,,,,
DP373,D7,"Enabled Twist interpolator: ""Included new API to lookup the velocity of the moving frame in the reference frame.""",-,Documentation,No,,,,,,,,,,
DP374,D7,"Enabled Twist interpolator: ""Included new API to lookup the velocity of the moving frame in the reference frame.""",-,Documentation,No,,,,,,,,,,
DP375,D7,"Add new node interface TypeDescriptionsInterface: ""Add new node interface TypeDescriptionsInterface to provide the GetTypeDescription service.""",-,Documentation,No,,,,,,,,,,
DP376,D7,"rclpy.node.Node.declare_parameter: ""The rclpy.node.Node.declare_parameter does not allow statically typing parameter without a default value.""",-,Documentation,No,,,,,,,,,,
DP377,D7,"Added types to method arguments: ""Added type checking to improve the experience for anyone using static type checking.""",-,Documentation,No,,,,,,,,,,
DP378,D7,"Rename of the --exclude CLI option: ""The --exclude CLI option was renamed to the --exclude-regex to better reflect what it does.""",-,Documentation,No,,,,,,,,,,
DP379,D7,"Changes in representation of the offered_qos_profiles: ""Enum values are now used for offered_qos_profiles in the code, in human-readable string values for QoS settings in the metadata, and in the overriding QoS profile YAML files.""",-,Documentation,No,,,,,,,,,,
DP380,D7,"Added node name to the read and write bag split event messages: ""Added node name to the read and write bag split event messages.""",-,Documentation,No,,,,,,,,,,
DP381,D7,"Added BagSplitInfo service call on bag close: ""Added BagSplitInfo service call on bag close.""",-,Documentation,No,,,,,,,,,,
DP382,D7,"Resolved multiple issues related to the handling SIGINT and SIGTERM signals in rosbag2: ""Resolved multiple issues related to the handling SIGINT and SIGTERM signals in rosbag2.""",-,Documentation,No,,,,,,,,,,
DP383,D7,"Added topic_id returned by storage to the TopicMetadata: ""Added topic_id returned by storage to the TopicMetadata.""",-,Documentation,No,,,,,,,,,,
DP384,D7,"Added Python bindings for CompressionOptions and CompressionMode structures: ""Added Python bindings for CompressionOptions and CompressionMode structures.""",-,Documentation,No,,,,,,,,,,
DP385,D7,"Improve performance in SqliteStorage::get_bagfile_size(): ""This minimizes the probability of losing messages during bag split operation when recording with the SQLite3 storage plugin.""",-,Documentation,Yes,,,,otimizaração de cálculo do tamanho do arquivo de gravação,,,,,,
DP386,D7,"Improved performance and updated rosbag API: ""There are some breaking changes in the rosbag2 API and Ubuntu Noble library versions that required some changes to rqt_bag.""",-,Documentation,Yes,,,,eficiência na manipulação de arquivos de rosbag,,,,,,